{
  "name": "blue_sd",
  "stops": [
    {
      "position": 0,
      "color": [
        0.3793034661181724,
        0.34040789975053165,
        0.7508803052488114
      ]
    },
    {
      "position": 0.023255813953488372,
      "color": [
        0.3976325589792201,
        0.36766544376408467,
        0.7680401253342565
      ]
    },
    {
      "position": 0.046511627906976744,
      "color": [
        0.4156228154081329,
        0.3949957866583141,
        0.7852253846352517
      ]
    },
    {
      "position": 0.06976744186046512,
      "color": [
        0.43330864085682713,
        0.42242270381844443,
        0.8024358462287073
      ]
    },
    {
      "position": 0.09302325581395349,
      "color": [
        0.4507187072297352,
        0.4499637359687955,
        0.8196713036101766
      ]
    },
    {
      "position": 0.11627906976744186,
      "color": [
        0.4678771876257229,
        0.47763189848429516,
        0.8369315816810977
      ]
    },
    {
      "position": 0.13953488372093023,
      "color": [
        0.4848046674251862,
        0.5054368555932399,
        0.8542165322366401
      ]
    },
    {
      "position": 0.16279069767441862,
      "color": [
        0.5015188348032825,
        0.5333857536594,
        0.8715260300839889
      ]
    },
    {
      "position": 0.18604651162790697,
      "color": [
        0.5040038984562412,
        0.5375829917347249,
        0.8741197228842384
      ]
    },
    {
      "position": 0.20930232558139536,
      "color": [
        0.5170885938006982,
        0.5525019141601941,
        0.882853961753396
      ]
    },
    {
      "position": 0.23255813953488372,
      "color": [
        0.5323785995494978,
        0.5701277769082589,
        0.893128744041837
      ]
    },
    {
      "position": 0.2558139534883721,
      "color": [
        0.5475718497453869,
        0.5878391347331349,
        0.9034063154913805
      ]
    },
    {
      "position": 0.27906976744186046,
      "color": [
        0.5626776403350616,
        0.6056349913772506,
        0.9136866720322696
      ]
    },
    {
      "position": 0.3023255813953488,
      "color": [
        0.5777042443113116,
        0.6235143659268424,
        0.9239698128904126
      ]
    },
    {
      "position": 0.32558139534883723,
      "color": [
        0.5926590543077891,
        0.6414762936102514,
        0.9342557402918829
      ]
    },
    {
      "position": 0.3488372093023256,
      "color": [
        0.6075487011892828,
        0.6595198263679894,
        0.9445444591913483
      ]
    },
    {
      "position": 0.37209302325581395,
      "color": [
        0.6223791533395194,
        0.6776440332366411,
        0.954835977022395
      ]
    },
    {
      "position": 0.3953488372093023,
      "color": [
        0.637155800305016,
        0.6958480005809768,
        0.9651303034679236
      ]
    },
    {
      "position": 0.4186046511627907,
      "color": [
        0.6518835236673065,
        0.7141308322024855,
        0.9754274502489376
      ]
    },
    {
      "position": 0.4418604651162791,
      "color": [
        0.6580562820012059,
        0.7218336643657571,
        0.979753528291785
      ]
    },
    {
      "position": 0.46511627906976744,
      "color": [
        0.6643195737343167,
        0.726026782802202,
        0.9807763715297279
      ]
    },
    {
      "position": 0.4883720930232558,
      "color": [
        0.6750628468312442,
        0.7332708714853562,
        0.9825348979380667
      ]
    },
    {
      "position": 0.5116279069767442,
      "color": [
        0.6857382783269689,
        0.7405326716817371,
        0.9842869193968725
      ]
    },
    {
      "position": 0.5348837209302325,
      "color": [
        0.6963495956269842,
        0.7478120120517,
        0.9860324105350652
      ]
    },
    {
      "position": 0.5581395348837209,
      "color": [
        0.7069002683726267,
        0.7551087252401065,
        0.9877713461126013
      ]
    },
    {
      "position": 0.5813953488372093,
      "color": [
        0.7173935316224211,
        0.7624226477436774,
        0.9895037010164395
      ]
    },
    {
      "position": 0.6046511627906976,
      "color": [
        0.7278324064630498,
        0.7697536197837083,
        0.9912294502565687
      ]
    },
    {
      "position": 0.627906976744186,
      "color": [
        0.7350553804708115,
        0.7748574819978237,
        0.9924246896404804
      ]
    },
    {
      "position": 0.6511627906976745,
      "color": [
        0.7384989166061473,
        0.7776590922595487,
        0.9926091935075861
      ]
    },
    {
      "position": 0.6744186046511628,
      "color": [
        0.7497324708884542,
        0.7868564831508208,
        0.9932046273064109
      ]
    },
    {
      "position": 0.6976744186046512,
      "color": [
        0.7608904882492469,
        0.7960787031666257,
        0.993785870239586
      ]
    },
    {
      "position": 0.7209302325581395,
      "color": [
        0.7719768150767568,
        0.8053254722820444,
        0.9943528124573499
      ]
    },
    {
      "position": 0.7441860465116279,
      "color": [
        0.782995041680365,
        0.8145965185193306,
        0.9949053436427951
      ]
    },
    {
      "position": 0.7674418604651163,
      "color": [
        0.7939485245964756,
        0.8238915776110411,
        0.9954433529918155
      ]
    },
    {
      "position": 0.7906976744186046,
      "color": [
        0.8048404064940475,
        0.8332103926803731,
        0.9959667291928435
      ]
    },
    {
      "position": 0.813953488372093,
      "color": [
        0.8156736339858098,
        0.8425527139376939,
        0.9964753604063591
      ]
    },
    {
      "position": 0.8372093023255814,
      "color": [
        0.8264509736063077,
        0.8519182983923415,
        0.9969691342441632
      ]
    },
    {
      "position": 0.8604651162790697,
      "color": [
        0.837175026180444,
        0.8613069095788173,
        0.9974479377484154
      ]
    },
    {
      "position": 0.8837209302325582,
      "color": [
        0.8478482397748167,
        0.87071831729655,
        0.9979116573704113
      ]
    },
    {
      "position": 0.9069767441860465,
      "color": [
        0.8584729213976448,
        0.8801522973624692,
        0.9983601789491005
      ]
    },
    {
      "position": 0.9302325581395349,
      "color": [
        0.8690512475907817,
        0.8896086313756596,
        0.9987933876893348
      ]
    },
    {
      "position": 0.9534883720930233,
      "color": [
        0.8795852740383322,
        0.8990871064934212,
        0.9992111681398302
      ]
    },
    {
      "position": 0.9767441860465116,
      "color": [
        0.8900769443002639,
        0.9085875152181073,
        0.9996134041708363
      ]
    },
    {
      "position": 1,
      "color": [
        0.9005281293207135,
        0.9181095973202068,
        0.9999999849571296
      ]
    }
  ],
  "underflowColour": [
    0,
    0,
    0
  ],
  "overflowColour": [
    1,
    1,
    1
  ],
  "metadata": {
    "source": "sciviscolor.org",
    "description": "Perceptually uniform blue colourmap (sd)"
  }
}