{
  "name": "ice_thickness_terrain",
  "stops": [
    {
      "position": 0,
      "color": [
        0.8,
        0.82,
        0.83
      ]
    },
    {
      "position": 0.1111111111111111,
      "color": [
        0.9,
        0.91,
        0.92
      ]
    },
    {
      "position": 0.2222222222222222,
      "color": [
        0.9,
        0.9,
        0.91
      ]
    },
    {
      "position": 0.3333333333333333,
      "color": [
        0.9,
        0.9,
        0.9
      ]
    },
    {
      "position": 0.4444444444444444,
      "color": [
        0.91,
        0.91,
        0.91
      ]
    },
    {
      "position": 0.5555555555555556,
      "color": [
        0.91,
        0.92,
        0.92
      ]
    },
    {
      "position": 0.6666666666666666,
      "color": [
        0.92,
        0.92,
        0.92
      ]
    },
    {
      "position": 0.7777777777777778,
      "color": [
        0.92,
        0.93,
        0.93
      ]
    },
    {
      "position": 0.8888888888888888,
      "color": [
        0.93,
        0.93,
        0.93
      ]
    },
    {
      "position": 1,
      "color": [
        0.93,
        0.94,
        0.94
      ]
    }
  ],
  "underflowColour": [
    0,
    0.2,
    0.2
  ],
  "overflowColour": [
    0.93,
    0.94,
    0.94
  ],
  "metadata": {
    "description": "Ice sheet whites for ice thickness visualization"
  }
}