{
  "name": "yellow_yel15",
  "stops": [
    {
      "position": 0,
      "color": [
        0.301961,
        0.047059,
        0.090196
      ]
    },
    {
      "position": 0.047619047619047616,
      "color": [
        0.4,
        0.039216,
        0.058824
      ]
    },
    {
      "position": 0.09523809523809523,
      "color": [
        0.501961,
        0.054902,
        0.031373
      ]
    },
    {
      "position": 0.14285714285714285,
      "color": [
        0.6,
        0.121569,
        0.023529
      ]
    },
    {
      "position": 0.19047619047619047,
      "color": [
        0.678431,
        0.180392,
        0.011765
      ]
    },
    {
      "position": 0.23809523809523808,
      "color": [
        0.760784,
        0.239216,
        0
      ]
    },
    {
      "position": 0.2857142857142857,
      "color": [
        0.8,
        0.305882,
        0
      ]
    },
    {
      "position": 0.3333333333333333,
      "color": [
        0.890196,
        0.411765,
        0.019608
      ]
    },
    {
      "position": 0.38095238095238093,
      "color": [
        0.909804,
        0.486275,
        0.035294
      ]
    },
    {
      "position": 0.42857142857142855,
      "color": [
        0.921569,
        0.545098,
        0.054902
      ]
    },
    {
      "position": 0.47619047619047616,
      "color": [
        0.929412,
        0.607843,
        0.094118
      ]
    },
    {
      "position": 0.5238095238095238,
      "color": [
        0.941176,
        0.678431,
        0.14902
      ]
    },
    {
      "position": 0.5714285714285714,
      "color": [
        0.94902,
        0.741176,
        0.219608
      ]
    },
    {
      "position": 0.6190476190476191,
      "color": [
        0.960784,
        0.803922,
        0.286275
      ]
    },
    {
      "position": 0.6666666666666666,
      "color": [
        0.968627,
        0.862745,
        0.388235
      ]
    },
    {
      "position": 0.7142857142857143,
      "color": [
        0.968627,
        0.905882,
        0.486275
      ]
    },
    {
      "position": 0.7619047619047619,
      "color": [
        0.980392,
        0.945098,
        0.576471
      ]
    },
    {
      "position": 0.8095238095238095,
      "color": [
        0.980392,
        0.968627,
        0.654902
      ]
    },
    {
      "position": 0.8571428571428571,
      "color": [
        0.988235,
        0.988235,
        0.741176
      ]
    },
    {
      "position": 0.9047619047619048,
      "color": [
        0.984314,
        0.988235,
        0.843137
      ]
    },
    {
      "position": 0.9523809523809523,
      "color": [
        1,
        1,
        0.988235
      ]
    },
    {
      "position": 1,
      "color": [
        1,
        1,
        0.988235
      ]
    }
  ],
  "underflowColour": [
    0,
    0,
    0.2
  ],
  "overflowColour": [
    1,
    0,
    1
  ],
  "metadata": {
    "source": "sciviscolor.org",
    "description": "Perceptually uniform yellow colourmap (Yel15)"
  }
}