{
  "name": "greyscale",
  "stops": [
    {
      "position": 0,
      "color": [
        0,
        0,
        0
      ]
    },
    {
      "position": 1,
      "color": [
        1,
        1,
        1
      ]
    }
  ],
  "underflowColour": [
    0,
    0,
    0.2
  ],
  "overflowColour": [
    1,
    0,
    1
  ],
  "metadata": {
    "description": "Simple black to white gradient"
  }
}