{
  "name": "extended_kindlmann",
  "stops": [
    {
      "position": 0,
      "color": [
        0,
        0,
        0
      ]
    },
    {
      "position": 0.06666666666666667,
      "color": [
        0.114621896,
        0.012116631,
        0.25430111
      ]
    },
    {
      "position": 0.13333333333333333,
      "color": [
        0.032722432,
        0.022251622,
        0.466353986
      ]
    },
    {
      "position": 0.2,
      "color": [
        0.016370126,
        0.193452028,
        0.340869045
      ]
    },
    {
      "position": 0.26666666666666666,
      "color": [
        0.013577264,
        0.281313081,
        0.239591784
      ]
    },
    {
      "position": 0.3333333333333333,
      "color": [
        0.017505711,
        0.359608356,
        0.103056381
      ]
    },
    {
      "position": 0.4,
      "color": [
        0.088086475,
        0.430359056,
        0.02076563
      ]
    },
    {
      "position": 0.4666666666666667,
      "color": [
        0.345901241,
        0.475652008,
        0.022699138
      ]
    },
    {
      "position": 0.5333333333333333,
      "color": [
        0.647380038,
        0.471950819,
        0.031044032
      ]
    },
    {
      "position": 0.6,
      "color": [
        0.963164467,
        0.382930018,
        0.227508854
      ]
    },
    {
      "position": 0.6666666666666666,
      "color": [
        0.975618044,
        0.489413302,
        0.530264615
      ]
    },
    {
      "position": 0.7333333333333333,
      "color": [
        0.979246791,
        0.564484358,
        0.884150643
      ]
    },
    {
      "position": 0.8,
      "color": [
        0.882320795,
        0.714076956,
        0.986232999
      ]
    },
    {
      "position": 0.8666666666666667,
      "color": [
        0.890857185,
        0.820709711,
        0.991331242
      ]
    },
    {
      "position": 0.9333333333333333,
      "color": [
        0.915472162,
        0.919226167,
        0.995940662
      ]
    },
    {
      "position": 1,
      "color": [
        1,
        1,
        1
      ]
    }
  ],
  "underflowColour": [
    0,
    0,
    0.2
  ],
  "overflowColour": [
    1,
    0,
    1
  ],
  "metadata": {
    "source": "kennethmoreland.com",
    "description": "Extended Kindlmann colourmap by Kenneth Moreland"
  }
}