{
  "name": "tr4",
  "stops": [
    {
      "position": 0,
      "color": [
        0.2,
        0.168627,
        0.160784
      ]
    },
    {
      "position": 0.09090909090909091,
      "color": [
        0.4,
        0.364706,
        0.341176
      ]
    },
    {
      "position": 0.18181818181818182,
      "color": [
        0.65098,
        0.623529,
        0.584314
      ]
    },
    {
      "position": 0.2727272727272727,
      "color": [
        0.8,
        0.780392,
        0.745098
      ]
    },
    {
      "position": 0.36363636363636365,
      "color": [
        0.901961,
        0.886275,
        0.854902
      ]
    },
    {
      "position": 0.45454545454545453,
      "color": [
        1,
        0.996078,
        0.968627
      ]
    },
    {
      "position": 0.5454545454545454,
      "color": [
        1,
        0.996078,
        0.968627
      ]
    },
    {
      "position": 0.6363636363636364,
      "color": [
        0.941176,
        0.878431,
        0.639216
      ]
    },
    {
      "position": 0.7272727272727273,
      "color": [
        0.878431,
        0.733333,
        0.47451
      ]
    },
    {
      "position": 0.8181818181818182,
      "color": [
        0.8,
        0.552941,
        0.337255
      ]
    },
    {
      "position": 0.9090909090909091,
      "color": [
        0.721569,
        0.376471,
        0.231373
      ]
    },
    {
      "position": 1,
      "color": [
        0.560784,
        0.133333,
        0.113725
      ]
    }
  ],
  "underflowColour": [
    0,
    0,
    0
  ],
  "overflowColour": [
    1,
    0,
    1
  ],
  "metadata": {
    "source": "sciviscolor.org",
    "description": "Diverging brown to orange colourmap (TR4)"
  }
}