{
  "name": "blackbody",
  "stops": [
    { "position": 0.0, "color": [0.0, 0.0, 0.0] },
    { "position": 0.39, "color": [0.698039216, 0.133333333, 0.133333333] },
    { "position": 0.58, "color": [1.086274510, 0.411764706, 0.019607843] },
    { "position": 0.89, "color": [0.901960784, 0.901960784, 0.207843137] },
    { "position": 1.0, "color": [1.0, 1.0, 1.0] }
  ],
  "underflowColour": [0.0, 0.0, 0.0],
  "overflowColour": [1.0, 0.0, 1.0]
}
