{
  "name": "water_depth_terrain",
  "stops": [
    {
      "position": 0,
      "color": [
        0.169412,
        0.359216,
        0.456863
      ]
    },
    {
      "position": 0.05,
      "color": [
        0.021824,
        0.165409,
        0.28098
      ]
    },
    {
      "position": 0.1,
      "color": [
        0.020157,
        0.169608,
        0.271176
      ]
    },
    {
      "position": 0.15,
      "color": [
        0.019216,
        0.152549,
        0.262353
      ]
    },
    {
      "position": 0.2,
      "color": [
        0.017615,
        0.146676,
        0.258724
      ]
    },
    {
      "position": 0.25,
      "color": [
        0.016014,
        0.140803,
        0.255096
      ]
    },
    {
      "position": 0.3,
      "color": [
        0.014413,
        0.13493,
        0.251468
      ]
    },
    {
      "position": 0.35,
      "color": [
        0.012812,
        0.129057,
        0.24784
      ]
    },
    {
      "position": 0.4,
      "color": [
        0.011211,
        0.123184,
        0.224212
      ]
    },
    {
      "position": 0.45,
      "color": [
        0.00961,
        0.117311,
        0.210583
      ]
    },
    {
      "position": 0.5,
      "color": [
        0.008009,
        0.111438,
        0.206955
      ]
    },
    {
      "position": 0.55,
      "color": [
        0.006409,
        0.105565,
        0.193327
      ]
    },
    {
      "position": 0.6,
      "color": [
        0.004808,
        0.099692,
        0.189699
      ]
    },
    {
      "position": 0.65,
      "color": [
        0.003207,
        0.093819,
        0.176071
      ]
    },
    {
      "position": 0.7,
      "color": [
        0.001606,
        0.087945,
        0.162443
      ]
    },
    {
      "position": 0.75,
      "color": [
        0.000005,
        0.082072,
        0.158815
      ]
    },
    {
      "position": 0.8,
      "color": [
        0,
        0.076199,
        0.145186
      ]
    },
    {
      "position": 0.85,
      "color": [
        0,
        0.070326,
        0.131558
      ]
    },
    {
      "position": 0.9,
      "color": [
        0,
        0.064453,
        0.10793
      ]
    },
    {
      "position": 0.95,
      "color": [
        0,
        0.05858,
        0.084302
      ]
    },
    {
      "position": 1,
      "color": [
        0,
        0.052549,
        0.062353
      ]
    }
  ],
  "underflowColour": [
    0,
    0,
    0.2
  ],
  "overflowColour": [
    0,
    0.052549,
    0.062353
  ],
  "metadata": {
    "description": "Ocean blues for water depth visualization"
  }
}