{
  "name": "elevation_terrain",
  "stops": [
    {
      "position": 0,
      "color": [
        0.2,
        0.185098,
        0.167255
      ]
    },
    {
      "position": 0.1111111111111111,
      "color": [
        0.258824,
        0.243922,
        0.238235
      ]
    },
    {
      "position": 0.2222222222222222,
      "color": [
        0.321569,
        0.306667,
        0.293137
      ]
    },
    {
      "position": 0.3333333333333333,
      "color": [
        0.380392,
        0.369412,
        0.358039
      ]
    },
    {
      "position": 0.4444444444444444,
      "color": [
        0.439216,
        0.426078,
        0.412941
      ]
    },
    {
      "position": 0.5555555555555556,
      "color": [
        0.509804,
        0.48451,
        0.479608
      ]
    },
    {
      "position": 0.6666666666666666,
      "color": [
        0.65098,
        0.631373,
        0.632941
      ]
    },
    {
      "position": 0.7777777777777778,
      "color": [
        0.74902,
        0.737255,
        0.72098
      ]
    },
    {
      "position": 0.8888888888888888,
      "color": [
        0.858824,
        0.858824,
        0.842549
      ]
    },
    {
      "position": 1,
      "color": [
        0.988235,
        0.988235,
        0.96902
      ]
    }
  ],
  "underflowColour": [
    0,
    0,
    0.2
  ],
  "overflowColour": [
    1,
    0,
    1
  ],
  "metadata": {
    "description": "Grey rocky appearance for terrain elevation"
  }
}