{
  "name": "water_state",
  "stops": [
    {
      "position": 0,
      "color": [
        0.2,
        0.2,
        0.4
      ]
    },
    {
      "position": 0.5,
      "color": [
        0,
        0.4,
        1
      ]
    },
    {
      "position": 1,
      "color": [
        0.7,
        0.7,
        0.9
      ]
    }
  ],
  "underflowColour": [
    0,
    0,
    0
  ],
  "overflowColour": [
    1,
    0,
    1
  ],
  "metadata": {
    "description": "Water phase visualization (solid/liquid/vapor)"
  }
}